28-01-2026
=========

SQL*Plus: Release 11.2.0.2.0 Production on Wed Jan 28 10:34:42 2026

Copyright (c) 1982, 2014, Oracle.  All rights reserved.

SQL> create user mgdb identified by mgdb;
SP2-0640: Not connected
SQL> connect / as sysdba;
Connected.
SQL> create user mgdb identified by mgdb;

User created.

SQL> connect mgdb;
Enter password:
ERROR:
ORA-01045: user MGDB lacks CREATE SESSION privilege; logon denied


Warning: You are no longer connected to ORACLE.
SQL> grant all previliges to mgdb;
SP2-0640: Not connected
SQL> connect / as sysdba;
Connected.
SQL> grant all previliges to mgdb;
grant all previliges to mgdb
      *
ERROR at line 1:
ORA-00990: missing or invalid privilege


SQL> grant all previleges to mgdb;
grant all previleges to mgdb
      *
ERROR at line 1:
ORA-00990: missing or invalid privilege


SQL> grant all privileges to mgdb;

Grant succeeded.

SQL> connect mgdb;
Enter password:
ERROR:
ORA-01017: invalid username/password; logon denied


Warning: You are no longer connected to ORACLE.
SQL> connect mgdb;
Enter password:
Connect


SQL*Plus: Release 11.2.0.2.0 Production on Wed Jan 28 10:52:29 2026

Copyright (c) 1982, 2014, Oracle.  All rights reserved.

SQL> connect mgdb;
Enter password:
Connected.
SQL> select * from tab;

no rows selected

SQL> create table student(htno number(2),sname varchar2(10),marks number(3));

Table created.

SQL> desc student;
 Name                                      Null?    Type
 ----------------------------------------- -------- ----------------------------
 HTNO                                               NUMBER(2)
 SNAME                                              VARCHAR2(10)
 MARKS                                              NUMBER(3)

SQL>

SQL*Plus: Release 11.2.0.2.0 Production on Wed Jan 28 11:02:29 2026

Copyright (c) 1982, 2014, Oracle.  All rights reserved.

SQL> connect mgdb;
Enter password:
Connected.
SQL> select * from tab;

TNAME                          TABTYPE  CLUSTERID
------------------------------ ------- ----------
STUDENT                        TABLE

SQL> desc student;
 Name                                      Null?    Type
 ----------------------------------------- -------- ----------------------------
 HTNO                                               NUMBER(2)
 SNAME                                              VARCHAR2(10)
 MARKS                                              NUMBER(3)

SQL> select * from student;

no rows selected

SQL> insert into student values(101,'Krishna',500);
insert into student values(101,'Krishna',500)
                           *
ERROR at line 1:
ORA-01438: value larger than specified precision allowed for this column


SQL> insert into student values(10,'Krishna',500);

1 row created.

SQL> select * from student;

      HTNO SNAME           MARKS
---------- ---------- ----------
        10 Krishna           500

SQL> insert into student values(11,'Rajesh',900);

1 row created.

SQL> insert into student values(12,'Mahesh',700);

1 row created.

SQL> insert into student values(13,'Suresh',600);

1 row created.

SQL> select * from student;

      HTNO SNAME           MARKS
---------- ---------- ----------
        10 Krishna           500
        11 Rajesh            900
        12 Mahesh            700
        13 Suresh            600

SQL>

29-01-2026
-----------

SQL*Plus: Release 11.2.0.2.0 Production on Thu Jan 29 10:11:52 2026

Copyright (c) 1982, 2014, Oracle.  All rights reserved.

SQL> connect / as sysdba;
Connected.
SQL> create user qtm230 identified by qtm230;

User created.

SQL> connect qtm230;
Enter password:
ERROR:
ORA-01045: user QTM230 lacks CREATE SESSION privilege; logon denied


Warning: You are no longer connected to ORACLE.
SQL> connect / as sysdba;
Connected.
SQL> grant all privileges to qtm230;

Grant succeeded.

SQL> connect qtm230;
Enter password:
Connected.
SQL> connect / as sysdba;
Connected.
SQL> revoke all privileges from qtm230;

Revoke succeeded.

SQL> connect qtm230;
Enter password:
ERROR:
ORA-01045: user QTM230 lacks CREATE SESSION privilege; logon denied


Warning: You are no longer connected to ORACLE.
SQL> connect qtm230;
Enter password:
ERROR:
ORA-01045: user QTM230 lacks CREATE SESSION privilege; logon denied


SQL> grant all privileges to qtm230;
SP2-0640: Not connected
SQL> connect / as sysdba;
Connected.
SQL> grant all privileges to qtm230;

Grant succeeded.

SQL> connect qtm230;
Enter password:
Connected.
SQL> create TaBle stu1(htno number(3),sname varchar2(50));

Table created.

SQL> desc stu1;
 Name                                      Null?    Type
 ----------------------------------------- -------- ----------------------------
 HTNO                                               NUMBER(3)
 SNAME                                              VARCHAR2(50)

SQL> alter table stu1 add(marks number(3));

Table altered.

SQL> desc stu1;
 Name                                      Null?    Type
 ----------------------------------------- -------- ----------------------------
 HTNO                                               NUMBER(3)
 SNAME                                              VARCHAR2(50)
 MARKS                                              NUMBER(3)

SQL> alter table stu1 modify(htno number(4));

Table altered.

SQL> desc stu1;
 Name                                      Null?    Type
 ----------------------------------------- -------- ----------------------------
 HTNO                                               NUMBER(4)
 SNAME                                              VARCHAR2(50)
 MARKS                                              NUMBER(3)

SQL> alter table stu1 modify(sname char(20));

Table altered.

SQL> desc stu1;
 Name                                      Null?    Type
 ----------------------------------------- -------- ----------------------------
 HTNO                                               NUMBER(4)
 SNAME                                              CHAR(20)
 MARKS                                              NUMBER(3)

SQL> alter table stu1 rename column htno to stuid;

Table altered.

SQL> desc stu1;
 Name                                      Null?    Type
 ----------------------------------------- -------- ----------------------------
 STUID                                              NUMBER(4)
 SNAME                                              CHAR(20)
 MARKS                                              NUMBER(3)

SQL> rename stu1 to student;

Table renamed.

SQL> desc stu1;
ERROR:
ORA-04043: object stu1 does not exist


SQL> desc student;
 Name                                      Null?    Type
 ----------------------------------------- -------- ----------------------------
 STUID                                              NUMBER(4)
 SNAME                                              CHAR(20)
 MARKS                                              NUMBER(3)

SQL> alter table student drop column marks;

Table altered.

SQL> desc student;
 Name                                      Null?    Type
 ----------------------------------------- -------- ----------------------------
 STUID                                              NUMBER(4)
 SNAME                                              CHAR(20)

SQL> alter table stu1 add(marks number(3));
alter table stu1 add(marks number(3))
*
ERROR at line 1:
ORA-00942: table or view does not exist


SQL> alter table student add(marks number(3));

Table altered.

SQL> desc student;
 Name                                      Null?    Type
 ----------------------------------------- -------- ----------------------------
 STUID                                              NUMBER(4)
 SNAME                                              CHAR(20)
 MARKS                                              NUMBER(3)

SQL> create table stu1 as select * from student;

Table created.

SQL> desc student;
 Name                                      Null?    Type
 ----------------------------------------- -------- ----------------------------
 STUID                                              NUMBER(4)
 SNAME                                              CHAR(20)
 MARKS                                              NUMBER(3)

SQL> desc stu1;
 Name                                      Null?    Type
 ----------------------------------------- -------- ----------------------------
 STUID                                              NUMBER(4)
 SNAME                                              CHAR(20)
 MARKS                                              NUMBER(3)

SQL> drop table student;

Table dropped.

SQL> desc student;
ERROR:
ORA-04043: object student does not exist


SQL> desc stu1;
 Name                                      Null?    Type
 ----------------------------------------- -------- ----------------------------
 STUID                                              NUMBER(4)
 SNAME                                              CHAR(20)
 MARKS                                              NUMBER(3)

SQL> insert into stu1 values(1001,'Krishna',999);

1 row created.

SQL> desc stu1;
 Name                                      Null?    Type
 ----------------------------------------- -------- ----------------------------
 STUID                                              NUMBER(4)
 SNAME                                              CHAR(20)
 MARKS                                              NUMBER(3)

SQL> select * from stu1;

     STUID SNAME                     MARKS
---------- -------------------- ----------
      1001 Krishna                     999

SQL> insert into stu1 values(1002,'Ramesh',899);

1 row created.

SQL> insert into stu1 values(1003,'Suresh',799);

1 row created.

SQL> insert into stu1 values(1004,'Mahesh',699);

1 row created.

SQL> insert into stu1 values(1005,'Ganesh',599);

1 row created.

SQL> select * from stu1;

     STUID SNAME                     MARKS
---------- -------------------- ----------
      1001 Krishna                     999
      1002 Ramesh                      899
      1003 Suresh                      799
      1004 Mahesh                      699
      1005 Ganesh                      599

SQL> insert into stu1 values(1006,'Ganesh',499);

1 row created.

SQL> select * from stu1;

     STUID SNAME                     MARKS
---------- -------------------- ----------
      1001 Krishna                     999
      1002 Ramesh                      899
      1003 Suresh                      799
      1004 Mahesh                      699
      1005 Ganesh                      599
      1006 Ganesh                      499

6 rows selected.

SQL> update stu1 set sname='Rajesh' where stuid=1006;

1 row updated.

SQL> select * from stu1;

     STUID SNAME                     MARKS
---------- -------------------- ----------
      1001 Krishna                     999
      1002 Ramesh                      899
      1003 Suresh                      799
      1004 Mahesh                      699
      1005 Ganesh                      599
      1006 Rajesh                      499

6 rows selected.

SQL> commit;

Commit complete.

SQL> update stu1 set sname='Rajesh';

6 rows updated.

SQL> select * from stu1;

     STUID SNAME                     MARKS
---------- -------------------- ----------
      1001 Rajesh                      999
      1002 Rajesh                      899
      1003 Rajesh                      799
      1004 Rajesh                      699
      1005 Rajesh                      599
      1006 Rajesh                      499

6 rows selected.

SQL> roll back;
Rollback complete.
SQL> select * from stu1;

     STUID SNAME                     MARKS
---------- -------------------- ----------
      1001 Krishna                     999
      1002 Ramesh                      899
      1003 Suresh                      799
      1004 Mahesh                      699
      1005 Ganesh                      599
      1006 Rajesh                      499

6 rows selected.

SQL> commit;

Commit complete.

SQL> insert into stu1 values(1111,'sdgsgs',000);

1 row created.

SQL> select * from stu1;

     STUID SNAME                     MARKS
---------- -------------------- ----------
      1001 Krishna                     999
      1002 Ramesh                      899
      1003 Suresh                      799
      1004 Mahesh                      699
      1005 Ganesh                      599
      1006 Rajesh                      499
      1111 sdgsgs                        0

7 rows selected.

SQL> commit;

Commit complete.

SQL> delete stu1;

7 rows deleted.

SQL> select * from stu1;

no rows selected

SQL> roll back;
Rollback complete.
SQL> select * from stu1;

     STUID SNAME                     MARKS
---------- -------------------- ----------
      1001 Krishna                     999
      1002 Ramesh                      899
      1003 Suresh                      799
      1004 Mahesh                      699
      1005 Ganesh                      599
      1006 Rajesh                      499
      1111 sdgsgs                        0

7 rows selected.

SQL> commit;

Commit complete.

SQL> delete stu1 where stuid=1111;

1 row deleted.

SQL> select * from stu1;

     STUID SNAME                     MARKS
---------- -------------------- ----------
      1001 Krishna                     999
      1002 Ramesh                      899
      1003 Suresh                      799
      1004 Mahesh                      699
      1005 Ganesh                      599
      1006 Rajesh                      499

6 rows selected.

SQL>
=====================
30-01-2026
--------


SQL> connect qtm230;
Enter password:
Connected.
SQL> select * from tab;

TNAME                          TABTYPE  CLUSTERID
------------------------------ ------- ----------
STU1                           TABLE

SQL> desc stu1;
 Name                                      Null?    Type
 ----------------------------------------- -------- ----------------------------
 STUID                                              NUMBER(4)
 SNAME                                              CHAR(20)
 MARKS                                              NUMBER(3)

SQL> select * from stu1;

     STUID SNAME                     MARKS
---------- -------------------- ----------
      1001 Krishna                     999
      1002 Ramesh                      899
      1003 Suresh                      799
      1004 Mahesh                      699
      1005 Ganesh                      599
      1006 Rajesh                      499

6 rows selected.

SQL> select stuid,sname from stu1;

     STUID SNAME
---------- --------------------
      1001 Krishna
      1002 Ramesh
      1003 Suresh
      1004 Mahesh
      1005 Ganesh
      1006 Rajesh

6 rows selected.

SQL> select stuid,sname from stu1 where sname='Ramesh';

     STUID SNAME
---------- --------------------
      1002 Ramesh

SQL> select stuid,sname from stu1 where marks>=700;

     STUID SNAME
---------- --------------------
      1001 Krishna
      1002 Ramesh
      1003 Suresh

SQL> select sname,marks from stu1 where marks>=700;

SNAME                     MARKS
-------------------- ----------
Krishna                     999
Ramesh                      899
Suresh                      799

SQL> create table emp1(eid number(5),ename varchar2(20),salary number(6,3),doj date);

Table created.

SQL> desc emp1;
 Name                                      Null?    Type
 ----------------------------------------- -------- ----------------------------
 EID                                                NUMBER(5)
 ENAME                                              VARCHAR2(20)
 SALARY                                             NUMBER(6,3)
 DOJ                                                DATE

SQL> insert into emp1 values(1,'Krishna',523.123,'10-jan-85');

1 row created.

SQL> select * from emp1;

       EID ENAME                    SALARY DOJ
---------- -------------------- ---------- ---------
         1 Krishna                 523.123 10-JAN-85

SQL> insert into emp1 values(1,'Krishna',523.123);
insert into emp1 values(1,'Krishna',523.123)
            *
ERROR at line 1:
ORA-00947: not enough values


SQL> insert into emp1(eid,ename) values(2,'Suresh');

1 row created.

SQL> select * from emp1;

       EID ENAME                    SALARY DOJ
---------- -------------------- ---------- ---------
         1 Krishna                 523.123 10-JAN-85
         2 Suresh

SQL> insert into emp1 values(&eid,&ename,&salary,&doj);
Enter value for eid: 3
Enter value for ename: 'Mahesh'
Enter value for salary: 5689
Enter value for doj: '01-jul-67'
old   1: insert into emp1 values(&eid,&ename,&salary,&doj)
new   1: insert into emp1 values(3,'Mahesh',5689,'01-jul-67')
insert into emp1 values(3,'Mahesh',5689,'01-jul-67')
                                   *
ERROR at line 1:
ORA-01438: value larger than specified precision allowed for this column


SQL> insert into emp1 values(&eid,&ename,&salary,&doj);
Enter value for eid: 3
Enter value for ename: 'abcd'
Enter value for salary: 123
Enter value for doj: '01-jul-67'
old   1: insert into emp1 values(&eid,&ename,&salary,&doj)
new   1: insert into emp1 values(3,'abcd',123,'01-jul-67')

1 row created.

SQL> /
Enter value for eid: 4
Enter value for ename: 'gggg'
Enter value for salary: 987
Enter value for doj: '01-jul-80'
old   1: insert into emp1 values(&eid,&ename,&salary,&doj)
new   1: insert into emp1 values(4,'gggg',987,'01-jul-80')

1 row created.

SQL> insert into emp1 values(&&eid,&&ename,&&salary,&&doj);
Enter value for eid: 5
Enter value for ename: 'yyyy'
Enter value for salary: 345
Enter value for doj: '01-aug-80'
old   1: insert into emp1 values(&&eid,&&ename,&&salary,&&doj)
new   1: insert into emp1 values(5,'yyyy',345,'01-aug-80')

1 row created.

SQL> //
old   1: insert into emp1 values(&&eid,&&ename,&&salary,&&doj)
new   1: insert into emp1 values(5,'yyyy',345,'01-aug-80')

1 row created.

SQL> //
old   1: insert into emp1 values(&&eid,&&ename,&&salary,&&doj)
new   1: insert into emp1 values(5,'yyyy',345,'01-aug-80')

1 row created.

SQL> //
old   1: insert into emp1 values(&&eid,&&ename,&&salary,&&doj)
new   1: insert into emp1 values(5,'yyyy',345,'01-aug-80')

1 row created.

SQL> select * from emp1;

       EID ENAME                    SALARY DOJ
---------- -------------------- ---------- ---------
         1 Krishna                 523.123 10-JAN-85
         2 Suresh
         3 abcd                        123 01-JUL-67
         4 gggg                        987 01-JUL-80
         5 yyyy                        345 01-AUG-80
         5 yyyy                        345 01-AUG-80
         5 yyyy                        345 01-AUG-80
         5 yyyy                        345 01-AUG-80

8 rows selected.

SQL> commit;

Commit complete.

SQL> create table emp2 as select * from emp1;

Table created.

SQL> create table emp3 as select * from emp1;

Table created.

SQL> create table emp4 as select * from emp1;

Table created.

SQL> select * from tab;

TNAME                          TABTYPE  CLUSTERID
------------------------------ ------- ----------
EMP1                           TABLE
EMP2                           TABLE
EMP3                           TABLE
EMP4                           TABLE
STU1                           TABLE

SQL> select * from emp4;

       EID ENAME                    SALARY DOJ
---------- -------------------- ---------- ---------
         1 Krishna                 523.123 10-JAN-85
         2 Suresh
         3 abcd                        123 01-JUL-67
         4 gggg                        987 01-JUL-80
         5 yyyy                        345 01-AUG-80
         5 yyyy                        345 01-AUG-80
         5 yyyy                        345 01-AUG-80
         5 yyyy                        345 01-AUG-80

8 rows selected.

SQL> truncate table emp4;

Table truncated.

SQL> select * from emp4;

no rows selected

SQL> desc emp4;
 Name                                      Null?    Type
 ----------------------------------------- -------- ----------------------------
 EID                                                NUMBER(5)
 ENAME                                              VARCHAR2(20)
 SALARY                                             NUMBER(6,3)
 DOJ                                                DATE

SQL> roll back;
Rollback complete.
SQL> select * from emp4;

no rows selected

SQL> drop emp4;
drop emp4
     *
ERROR at line 1:
ORA-00950: invalid DROP option


SQL> drop table emp4;

Table dropped.

SQL> select * from emp4;
select * from emp4
              *
ERROR at line 1:
ORA-00942: table or view does not exist


SQL> desc emp4;
ERROR:
ORA-04043: object emp4 does not exist


SQL> roll back;
Rollback complete.
SQL> desc emp4;
ERROR:
ORA-04043: object emp4 does not exist


SQL> select * from emp4;
select * from emp4
              *
ERROR at line 1:
ORA-00942: table or view does not exist


SQL> select * from emp3;

       EID ENAME                    SALARY DOJ
---------- -------------------- ---------- ---------
         1 Krishna                 523.123 10-JAN-85
         2 Suresh
         3 abcd                        123 01-JUL-67
         4 gggg                        987 01-JUL-80
         5 yyyy                        345 01-AUG-80
         5 yyyy                        345 01-AUG-80
         5 yyyy                        345 01-AUG-80
         5 yyyy                        345 01-AUG-80

8 rows selected.

SQL> commit;

Commit complete.

SQL> drop table emp3;

Table dropped.

SQL> select * from emp3;
select * from emp3
              *
ERROR at line 1:
ORA-00942: table or view does not exist


SQL> desc emp3;
ERROR:
ORA-04043: object emp3 does not exist


SQL> roll back;
Rollback complete.
SQL> select * from tab;

TNAME                          TABTYPE  CLUSTERID
------------------------------ ------- ----------
EMP1                           TABLE
EMP2                           TABLE
STU1                           TABLE

SQL> select * from emp2;

       EID ENAME                    SALARY DOJ
---------- -------------------- ---------- ---------
         1 Krishna                 523.123 10-JAN-85
         2 Suresh
         3 abcd                        123 01-JUL-67
         4 gggg                        987 01-JUL-80
         5 yyyy                        345 01-AUG-80
         5 yyyy                        345 01-AUG-80
         5 yyyy                        345 01-AUG-80
         5 yyyy                        345 01-AUG-80

8 rows selected.

SQL> delete emp2;

8 rows deleted.

SQL> select * from emp2;

no rows selected

SQL> desc emp2;
 Name                                      Null?    Type
 ----------------------------------------- -------- ----------------------------
 EID                                                NUMBER(5)
 ENAME                                              VARCHAR2(20)
 SALARY                                             NUMBER(6,3)
 DOJ                                                DATE

SQL> roll back;
Rollback complete.
SQL> select * from emp2;

       EID ENAME                    SALARY DOJ
---------- -------------------- ---------- ---------
         1 Krishna                 523.123 10-JAN-85
         2 Suresh
         3 abcd                        123 01-JUL-67
         4 gggg                        987 01-JUL-80
         5 yyyy                        345 01-AUG-80
         5 yyyy                        345 01-AUG-80
         5 yyyy                        345 01-AUG-80
         5 yyyy                        345 01-AUG-80

8 rows selected.

SQL> commit;

Commit complete.

SQL> delete emp2 where eid=1;

1 row deleted.

SQL> select * from emp2;

       EID ENAME                    SALARY DOJ
---------- -------------------- ---------- ---------
         2 Suresh
         3 abcd                        123 01-JUL-67
         4 gggg                        987 01-JUL-80
         5 yyyy                        345 01-AUG-80
         5 yyyy                        345 01-AUG-80
         5 yyyy                        345 01-AUG-80
         5 yyyy                        345 01-AUG-80

7 rows selected.

SQL> roll back;
Rollback complete.
SQL> select * from emp2;

       EID ENAME                    SALARY DOJ
---------- -------------------- ---------- ---------
         1 Krishna                 523.123 10-JAN-85
         2 Suresh
         3 abcd                        123 01-JUL-67
         4 gggg                        987 01-JUL-80
         5 yyyy                        345 01-AUG-80
         5 yyyy                        345 01-AUG-80
         5 yyyy                        345 01-AUG-80
         5 yyyy                        345 01-AUG-80

8 rows selected.

SQL> commit;

Commit complete.

SQL> select * from emp2;

       EID ENAME                    SALARY DOJ
---------- -------------------- ---------- ---------
         1 Krishna                 523.123 10-JAN-85
         2 Suresh
         3 abcd                        123 01-JUL-67
         4 gggg                        987 01-JUL-80
         5 yyyy                        345 01-AUG-80
         5 yyyy                        345 01-AUG-80
         5 yyyy                        345 01-AUG-80
         5 yyyy                        345 01-AUG-80

8 rows selected.

SQL> delete emp2 where eid=5;

4 rows deleted.

SQL> commit;

Commit complete.

SQL> select * from emp2;

       EID ENAME                    SALARY DOJ
---------- -------------------- ---------- ---------
         1 Krishna                 523.123 10-JAN-85
         2 Suresh
         3 abcd                        123 01-JUL-67
         4 gggg                        987 01-JUL-80

SQL> roll back;
Rollback complete.
SQL> select * from emp2;

       EID ENAME                    SALARY DOJ
---------- -------------------- ---------- ---------
         1 Krishna                 523.123 10-JAN-85
         2 Suresh
         3 abcd                        123 01-JUL-67
         4 gggg                        987 01-JUL-80

SQL> insert into emp2 values(5,'gfg',456,'23-dec-25');

1 row created.

SQL> select * from emp2;

       EID ENAME                    SALARY DOJ
---------- -------------------- ---------- ---------
         1 Krishna                 523.123 10-JAN-85
         2 Suresh
         3 abcd                        123 01-JUL-67
         4 gggg                        987 01-JUL-80
         5 gfg                         456 23-DEC-25

SQL> roll back;
Rollback complete.
SQL> select * from emp2;

       EID ENAME                    SALARY DOJ
---------- -------------------- ---------- ---------
         1 Krishna                 523.123 10-JAN-85
         2 Suresh
         3 abcd                        123 01-JUL-67
         4 gggg                        987 01-JUL-80

SQL> insert into emp2 values(5,'gfg',456,'23-dec-25');

1 row created.

SQL> select * from emp2;

       EID ENAME                    SALARY DOJ
---------- -------------------- ---------- ---------
         1 Krishna                 523.123 10-JAN-85
         2 Suresh
         3 abcd                        123 01-JUL-67
         4 gggg                        987 01-JUL-80
         5 gfg                         456 23-DEC-25

SQL> insert into emp2 values(6,'gfg',456,'23-dec-25');

1 row created.

SQL> select * from emp2;

       EID ENAME                    SALARY DOJ
---------- -------------------- ---------- ---------
         1 Krishna                 523.123 10-JAN-85
         2 Suresh
         3 abcd                        123 01-JUL-67
         4 gggg                        987 01-JUL-80
         5 gfg                         456 23-DEC-25
         6 gfg                         456 23-DEC-25

6 rows selected.

SQL> delete table emp2 where eid=6;
delete table emp2 where eid=6
       *
ERROR at line 1:
ORA-00903: invalid table name


SQL> delete  emp2 where eid=6;

1 row deleted.

SQL> select * from emp2;

       EID ENAME                    SALARY DOJ
---------- -------------------- ---------- ---------
         1 Krishna                 523.123 10-JAN-85
         2 Suresh
         3 abcd                        123 01-JUL-67
         4 gggg                        987 01-JUL-80
         5 gfg                         456 23-DEC-25

SQL> roll back;
Rollback complete.
SQL> select * from emp2;

       EID ENAME                    SALARY DOJ
---------- -------------------- ---------- ---------
         1 Krishna                 523.123 10-JAN-85
         2 Suresh
         3 abcd                        123 01-JUL-67
         4 gggg                        987 01-JUL-80

SQL> insert into emp2 values(6,'gfg',456,'23-dec-25');

1 row created.

SQL> commit;

Commit complete.

SQL> select * from emp2;

       EID ENAME                    SALARY DOJ
---------- -------------------- ---------- ---------
         1 Krishna                 523.123 10-JAN-85
         2 Suresh
         3 abcd                        123 01-JUL-67
         4 gggg                        987 01-JUL-80
         6 gfg                         456 23-DEC-25

SQL> insert into emp2 values(5,'gfg',456,'23-dec-25');

1 row created.

SQL> insert into emp2 values(7,'gfg',456,'23-dec-25');

1 row created.

SQL> insert into emp2 values(8,'gfg',456,'23-dec-25');

1 row created.

SQL> update table emp2 set ename='Rao' where eid=8;
update table emp2 set ename='Rao' where eid=8
       *
ERROR at line 1:
ORA-00903: invalid table name


SQL> update emp2 set ename='Rao' where eid=8;

1 row updated.

SQL> select * from emp2;

       EID ENAME                    SALARY DOJ
---------- -------------------- ---------- ---------
         1 Krishna                 523.123 10-JAN-85
         2 Suresh
         3 abcd                        123 01-JUL-67
         4 gggg                        987 01-JUL-80
         6 gfg                         456 23-DEC-25
         5 gfg                         456 23-DEC-25
         7 gfg                         456 23-DEC-25
         8 Rao                         456 23-DEC-25

8 rows selected.

SQL> roll back;
Rollback complete.
SQL> select * from emp2;

       EID ENAME                    SALARY DOJ
---------- -------------------- ---------- ---------
         1 Krishna                 523.123 10-JAN-85
         2 Suresh
         3 abcd                        123 01-JUL-67
         4 gggg                        987 01-JUL-80
         6 gfg                         456 23-DEC-25

SQL> select * from emp2;

       EID ENAME                    SALARY DOJ
---------- -------------------- ---------- ---------
         1 Krishna                 523.123 10-JAN-85
         2 Suresh
         3 abcd                        123 01-JUL-67
         4 gggg                        987 01-JUL-80
         6 gfg                         456 23-DEC-25

SQL> commit;

Commit complete.

SQL> insert into emp2 values(5,'gfg',456,'23-dec-25');

1 row created.

SQL> select * from emp2;

       EID ENAME                    SALARY DOJ
---------- -------------------- ---------- ---------
         1 Krishna                 523.123 10-JAN-85
         2 Suresh
         3 abcd                        123 01-JUL-67
         4 gggg                        987 01-JUL-80
         6 gfg                         456 23-DEC-25
         5 gfg                         456 23-DEC-25

6 rows selected.

SQL> delete  emp2 where eid=5;

1 row deleted.

SQL> select * from emp2;

       EID ENAME                    SALARY DOJ
---------- -------------------- ---------- ---------
         1 Krishna                 523.123 10-JAN-85
         2 Suresh
         3 abcd                        123 01-JUL-67
         4 gggg                        987 01-JUL-80
         6 gfg                         456 23-DEC-25

SQL> insert into emp2 values(7,'gfg',456,'23-dec-25');

1 row created.

SQL> select * from emp2;

       EID ENAME                    SALARY DOJ
---------- -------------------- ---------- ---------
         1 Krishna                 523.123 10-JAN-85
         2 Suresh
         3 abcd                        123 01-JUL-67
         4 gggg                        987 01-JUL-80
         7 gfg                         456 23-DEC-25
         6 gfg                         456 23-DEC-25

6 rows selected.

SQL> select * from emp2 order by eid;

       EID ENAME                    SALARY DOJ
---------- -------------------- ---------- ---------
         1 Krishna                 523.123 10-JAN-85
         2 Suresh
         3 abcd                        123 01-JUL-67
         4 gggg                        987 01-JUL-80
         6 gfg                         456 23-DEC-25
         7 gfg                         456 23-DEC-25

6 rows selected.

SQL> insert into emp2 values(5,'ppp',456,'23-dec-25');

1 row created.

SQL> select * from emp2 order by eid;

       EID ENAME                    SALARY DOJ
---------- -------------------- ---------- ---------
         1 Krishna                 523.123 10-JAN-85
         2 Suresh
         3 abcd                        123 01-JUL-67
         4 gggg                        987 01-JUL-80
         5 ppp                         456 23-DEC-25
         6 gfg                         456 23-DEC-25
         7 gfg                         456 23-DEC-25

7 rows selected.

SQL> commit;

Commit complete.

SQL>
==============
02-02-202


SQL*Plus: Release 11.2.0.2.0 Production on Mon Feb 2 10:13:19 2026

Copyright (c) 1982, 2014, Oracle.  All rights reserved.

SQL> connect qtm230;
Enter password:
Connected.
SQL> create table supplier(sup_no varchar2(2) primary key,sup_Name varchar2(20) not null,item_supplied varchar(20) not null,iteam_price number(5),city varchar2(20));

Table created.

SQL> desc supplier;
 Name                                      Null?    Type
 ----------------------------------------- -------- ----------------------------
 SUP_NO                                    NOT NULL VARCHAR2(2)
 SUP_NAME                                  NOT NULL VARCHAR2(20)
 ITEM_SUPPLIED                             NOT NULL VARCHAR2(20)
 ITEAM_PRICE                                        NUMBER(5)
 CITY                                               VARCHAR2(20)
     insert into supplier('S1','Suresh','Keyboard',400,'Hyderabad');
insert into supplier('S1','Suresh','Keyboard',400,'Hyderabad')
                     *
ERROR at line 1:
ORA-00928: missing SELECT keyword


SQL> insert into supplier('S1','Suresh','Keyboard',400,'Hyderabad');
insert into supplier('S1','Suresh','Keyboard',400,'Hyderabad')
                     *
ERROR at line 1:
ORA-00928: missing SELECT keyword


SQL> insert into supplier values('S1','Suresh','Keyboard',400,'Hyderabad');

1 row created.

SQL> insert into supplier values('S1','Suresh','Keyboard',400,'Hyderabad');
insert into supplier values('S1','Suresh','Keyboard',400,'Hyderabad')
*
ERROR at line 1:
ORA-00001: unique constraint (QTM230.SYS_C007171) violated


SQL> insert into supplier(sup_no,ITEM_SUPPLIED,ITEAM_PRICE,CITY) values('S2','gdfd',567,'gsdgs');
insert into supplier(sup_no,ITEM_SUPPLIED,ITEAM_PRICE,CITY) values('S2','gdfd',567,'gsdgs')
*
ERROR at line 1:
ORA-01400: cannot insert NULL into ("QTM230"."SUPPLIER"."SUP_NAME")


SQL> insert into supplier(sup_no,SUP_NAME,ITEM_SUPPLIED,ITEAM_PRICE) values('S2','dgdsg','gdfd',567);

1 row created.

SQL> select * from supplier;

SU SUP_NAME             ITEM_SUPPLIED        ITEAM_PRICE CITY
-- -------------------- -------------------- ----------- --------------------
S1 Suresh               Keyboard                     400 Hyderabad
S2 dgdsg                gdfd                         567

SQL> delete table supplier where sup_no='s2';
delete table supplier where sup_no='s2'
       *
ERROR at line 1:
ORA-00903: invalid table name


SQL> delete supplier where sup_no='s2';

0 rows deleted.

SQL> delete supplier where sup_no='S2';

1 row deleted.

SQL> select * from supplier;

SU SUP_NAME             ITEM_SUPPLIED        ITEAM_PRICE CITY
-- -------------------- -------------------- ----------- --------------------
S1 Suresh               Keyboard                     400 Hyderabad

SQL> commit;

Commit complete.
     insert into supplier('S2','Kiran','Processor',8000,'Delhi');
insert into supplier('S2','Kiran','Processor',8000,'Delhi')
                     *
ERROR at line 1:
ORA-00928: missing SELECT keyword


SQL> insert into supplier  values('S2','Kiran','Processor',8000,'Delhi');

1 row created.

SQL> select * from supplier;

SU SUP_NAME             ITEM_SUPPLIED        ITEAM_PRICE CITY
-- -------------------- -------------------- ----------- --------------------
S1 Suresh               Keyboard                     400 Hyderabad
S2 Kiran                Processor                   8000 Delhi

SQL> commit;

Commit complete.

SQL>
==========================
03-02-2026
------------


SQL*Plus: Release 11.2.0.2.0 Production on Tue Feb 3 10:12:34 2026

Copyright (c) 1982, 2014, Oracle.  All rights reserved.

SQL> connect qtm230;
Enter password:
Connected.
SQL> selwct * from tab;
SP2-0734: unknown command beginning "selwct * f..." - rest of line ignored.
SQL> select * from tab;

TNAME                          TABTYPE  CLUSTERID
------------------------------ ------- ----------
EMP1                           TABLE
EMP2                           TABLE
STU1                           TABLE
SUPPLIER                       TABLE

SQL> create table s1(id number(3),sal number(3) check(sal>500));

Table created.

SQL> desc s1;
 Name                                      Null?    Type
 ----------------------------------------- -------- ----------------------------
 ID                                                 NUMBER(3)
 SAL                                                NUMBER(3)

SQL> insert into s1 values(1,300);
insert into s1 values(1,300)
*
ERROR at line 1:
ORA-02290: check constraint (QTM230.SYS_C007178) violated


SQL> insert into s1 values(1,500);
insert into s1 values(1,500)
*
ERROR at line 1:
ORA-02290: check constraint (QTM230.SYS_C007178) violated


SQL> insert into s1 values(1,501);

1 row created.

SQL> insert into s1 values(2,601);

1 row created.

SQL> select * from s1;

        ID        SAL
---------- ----------
         1        501
         2        601

SQL> alter table s1 add(empstatus varchar2(5) default 'active');
alter table s1 add(empstatus varchar2(5) default 'active')
                                                 *
ERROR at line 1:
ORA-01401: inserted value too large for column


SQL> alter table s1 add(empstatus varchar2(5) default= 'active');
alter table s1 add(empstatus varchar2(5) default= 'active')
                                                *
ERROR at line 1:
ORA-00936: missing expression


SQL> alter table s1 add empstatus varchar2(5) default= 'active';
alter table s1 add empstatus varchar2(5) default= 'active'
                                                *
ERROR at line 1:
ORA-00936: missing expression


SQL> alter table s1 add empstatus varchar2(5) default 'active';
alter table s1 add empstatus varchar2(5) default 'active'
                                                 *
ERROR at line 1:
ORA-01401: inserted value too large for column


SQL> alter table s1 add empstatus varchar2(8) default 'active';

Table altered.

SQL> select * from s1;

        ID        SAL EMPSTATU
---------- ---------- --------
         1        501 active
         2        601 active

SQL> insert into s1(id,sal) values(3,701);

1 row created.

SQL> select * from s1;

        ID        SAL EMPSTATU
---------- ---------- --------
         1        501 active
         2        601 active
         3        701 active

SQL> insert into s1(id) values(4);

1 row created.

SQL> select * from s1;

        ID        SAL EMPSTATU
---------- ---------- --------
         1        501 active
         2        601 active
         3        701 active
         4            active

SQL> select * from dual;

D
-
X

SQL> select 2+3 from dual;

       2+3
----------
         5

SQL> select 2+3 from s1;

       2+3
----------
         5
         5
         5
         5

SQL> select 2-3 from dual;

       2-3
----------
        -1

SQL> select 2-3 as Substraction from dual;

SUBSTRACTION
------------
          -1

SQL> select 2*3 as Mul from dual;

       MUL
----------
         6

SQL> alter table s1 da number(3) default 200;
alter table s1 da number(3) default 200
               *
ERROR at line 1:
ORA-01735: invalid ALTER TABLE option


SQL> alter table s1 add da number(3) default 200;

Table altered.

SQL> select * from s1;

        ID        SAL EMPSTATU         DA
---------- ---------- -------- ----------
         1        501 active          200
         2        601 active          200
         3        701 active          200
         4            active          200

SQL> alter table s1 add totalsal number(4);

Table altered.

SQL> select * from s1;

        ID        SAL EMPSTATU         DA   TOTALSAL
---------- ---------- -------- ---------- ----------
         1        501 active          200
         2        601 active          200
         3        701 active          200
         4            active          200

SQL> update s1 set totalsal=sal+da where id=1;

1 row updated.

SQL> select * from s1;

        ID        SAL EMPSTATU         DA   TOTALSAL
---------- ---------- -------- ---------- ----------
         1        501 active          200        701
         2        601 active          200
         3        701 active          200
         4            active          200

SQL> update s1 set totalsal=sal+da;

4 rows updated.

SQL> select * from s1;

        ID        SAL EMPSTATU         DA   TOTALSAL
---------- ---------- -------- ---------- ----------
         1        501 active          200        701
         2        601 active          200        801
         3        701 active          200        901
         4            active          200

SQL> select * from s1; where sal>=600;
select * from s1; where sal>=600
                *
ERROR at line 1:
ORA-00911: invalid character


SQL> select * from s1 where sal>=600;

        ID        SAL EMPSTATU         DA   TOTALSAL
---------- ---------- -------- ---------- ----------
         2        601 active          200        801
         3        701 active          200        901

SQL> select * from s1 where sal=600;

no rows selected

SQL> select * from s1 where sal==600;
select * from s1 where sal==600
                           *
ERROR at line 1:
ORA-00936: missing expression


SQL> select * from s1 where sal!=600;

        ID        SAL EMPSTATU         DA   TOTALSAL
---------- ---------- -------- ---------- ----------
         1        501 active          200        701
         2        601 active          200        801
         3        701 active          200        901

SQL> select * from s1 where sal<>600;

        ID        SAL EMPSTATU         DA   TOTALSAL
---------- ---------- -------- ---------- ----------
         1        501 active          200        701
         2        601 active          200        801
         3        701 active          200        901

SQL> select * from s1 where id=1 and sal=501;

        ID        SAL EMPSTATU         DA   TOTALSAL
---------- ---------- -------- ---------- ----------
         1        501 active          200        701

SQL> select * from s1 where id=1 or sal=501;

        ID        SAL EMPSTATU         DA   TOTALSAL
---------- ---------- -------- ---------- ----------
         1        501 active          200        701

SQL> select * from s1 where id=1 and sal=500;

no rows selected

SQL> select * from s1 where id=1 or sal=500;

        ID        SAL EMPSTATU         DA   TOTALSAL
---------- ---------- -------- ---------- ----------
         1        501 active          200        701

SQL> select * from s1 where id=11 or sal=500;

no rows selected

SQL> select * from tab;

TNAME                          TABTYPE  CLUSTERID
------------------------------ ------- ----------
EMP1                           TABLE
EMP2                           TABLE
S1                             TABLE
STU1                           TABLE
SUPPLIER                       TABLE

SQL> select * from supplier;

SU SUP_NAME             ITEM_SUPPLIED        ITEAM_PRICE CITY
-- -------------------- -------------------- ----------- --------------------
S1 Suresh               Keyboard                     400 Hyderabad
S2 Kiran                Processor                   8000 Delhi

SQL> desc supplier;
 Name                                      Null?    Type
 ----------------------------------------- -------- ----------------------------
 SUP_NO                                    NOT NULL VARCHAR2(2)
 SUP_NAME                                  NOT NULL VARCHAR2(20)
 ITEM_SUPPLIED                             NOT NULL VARCHAR2(20)
 ITEAM_PRICE                                        NUMBER(5)
 CITY                                               VARCHAR2(20)

SQL> insert into supplier values(&sup_no,&sup_name,&iteam_supplied,&iteam_price,city);
Enter value for sup_no: 'S3'
Enter value for sup_name: 'Mohan'
Enter value for iteam_supplied: 'Mouse'
Enter value for iteam_price: 350
old   1: insert into supplier values(&sup_no,&sup_name,&iteam_supplied,&iteam_price,city)
new   1: insert into supplier values('S3','Mohan','Mouse',350,city)
insert into supplier values('S3','Mohan','Mouse',350,city)
                                                     *
ERROR at line 1:
ORA-00984: column not allowed here


SQL> /
Enter value for sup_no: 'S3'
Enter value for sup_name: 'Mohan'
Enter value for iteam_supplied: 'Mouse'
Enter value for iteam_price: 350
old   1: insert into supplier values(&sup_no,&sup_name,&iteam_supplied,&iteam_price,city)
new   1: insert into supplier values('S3','Mohan','Mouse',350,city)
insert into supplier values('S3','Mohan','Mouse',350,city)
                                                     *
ERROR at line 1:
ORA-00984: column not allowed here


SQL> insert into supplier values(&sup_no,&sup_name,&iteam_supplied,&iteam_price,&city);
Enter value for sup_no: 'S3'
Enter value for sup_name: 'Mohan'
Enter value for iteam_supplied: 'Mouse'
Enter value for iteam_price: 350
Enter value for city: 'Delhi'
old   1: insert into supplier values(&sup_no,&sup_name,&iteam_supplied,&iteam_price,&city)
new   1: insert into supplier values('S3','Mohan','Mouse',350,'Delhi')

1 row created.

SQL> /
Enter value for sup_no: 'S4'
Enter value for sup_name: 'Ramesh'
Enter value for iteam_supplied: 'Processor'
Enter value for iteam_price: 9000
Enter value for city: 'Bangalore'
old   1: insert into supplier values(&sup_no,&sup_name,&iteam_supplied,&iteam_price,&city)
new   1: insert into supplier values('S4','Ramesh','Processor',9000,'Bangalore')

1 row created.

SQL> /
Enter value for sup_no: 'S5'
Enter value for sup_name: 'Manish'
Enter value for iteam_supplied: 'Printer'
Enter value for iteam_price: 6000
Enter value for city: 'Mumbai'
old   1: insert into supplier values(&sup_no,&sup_name,&iteam_supplied,&iteam_price,&city)
new   1: insert into supplier values('S5','Manish','Printer',6000,'Mumbai')

1 row created.

SQL> /
Enter value for sup_no: 'S6'
Enter value for sup_name: 'Srikanth'
Enter value for iteam_supplied: 'Processor'
Enter value for iteam_price: 8500
Enter value for city: 'Chennai'
old   1: insert into supplier values(&sup_no,&sup_name,&iteam_supplied,&iteam_price,&city)
new   1: insert into supplier values('S6','Srikanth','Processor',8500,'Chennai')

1 row created.

SQL> select * from supplier;

SU SUP_NAME             ITEM_SUPPLIED        ITEAM_PRICE CITY
-- -------------------- -------------------- ----------- --------------------
S1 Suresh               Keyboard                     400 Hyderabad
S4 Ramesh               Processor                   9000 Bangalore
S2 Kiran                Processor                   8000 Delhi
S3 Mohan                Mouse                        350 Delhi
S5 Manish               Printer                     6000 Mumbai
S6 Srikanth             Processor                   8500 Chennai

6 rows selected.

SQL> select * from supplier where sup_name like 'M%';

SU SUP_NAME             ITEM_SUPPLIED        ITEAM_PRICE CITY
-- -------------------- -------------------- ----------- --------------------
S3 Mohan                Mouse                        350 Delhi
S5 Manish               Printer                     6000 Mumbai

SQL> select * from supplier where sup_name like 'm%';

no rows selected

SQL> select * from supplier where sup_name like '%h';

SU SUP_NAME             ITEM_SUPPLIED        ITEAM_PRICE CITY
-- -------------------- -------------------- ----------- --------------------
S1 Suresh               Keyboard                     400 Hyderabad
S4 Ramesh               Processor                   9000 Bangalore
S5 Manish               Printer                     6000 Mumbai
S6 Srikanth             Processor                   8500 Chennai

SQL> select * from supplier where sup_name like '%sh';

SU SUP_NAME             ITEM_SUPPLIED        ITEAM_PRICE CITY
-- -------------------- -------------------- ----------- --------------------
S1 Suresh               Keyboard                     400 Hyderabad
S4 Ramesh               Processor                   9000 Bangalore
S5 Manish               Printer                     6000 Mumbai

SQL> select * from supplier where sup_name like '%esh';

SU SUP_NAME             ITEM_SUPPLIED        ITEAM_PRICE CITY
-- -------------------- -------------------- ----------- --------------------
S1 Suresh               Keyboard                     400 Hyderabad
S4 Ramesh               Processor                   9000 Bangalore

SQL> select * from supplier where sup_name like '%esh%';

SU SUP_NAME             ITEM_SUPPLIED        ITEAM_PRICE CITY
-- -------------------- -------------------- ----------- --------------------
S1 Suresh               Keyboard                     400 Hyderabad
S4 Ramesh               Processor                   9000 Bangalore

SQL> select * from supplier where sup_name like '%h%';

SU SUP_NAME             ITEM_SUPPLIED        ITEAM_PRICE CITY
-- -------------------- -------------------- ----------- --------------------
S1 Suresh               Keyboard                     400 Hyderabad
S4 Ramesh               Processor                   9000 Bangalore
S3 Mohan                Mouse                        350 Delhi
S5 Manish               Printer                     6000 Mumbai
S6 Srikanth             Processor                   8500 Chennai

SQL> select * from supplier where sup_name like '%h';

SU SUP_NAME             ITEM_SUPPLIED        ITEAM_PRICE CITY
-- -------------------- -------------------- ----------- --------------------
S1 Suresh               Keyboard                     400 Hyderabad
S4 Ramesh               Processor                   9000 Bangalore
S5 Manish               Printer                     6000 Mumbai
S6 Srikanth             Processor                   8500 Chennai

SQL> select * from supplier where sup_name like '%ah';

no rows selected

SQL> select * from supplier where sup_name like '%ah%';

no rows selected

SQL> select * from supplier where sup_name like '_a%';

SU SUP_NAME             ITEM_SUPPLIED        ITEAM_PRICE CITY
-- -------------------- -------------------- ----------- --------------------
S4 Ramesh               Processor                   9000 Bangalore
S5 Manish               Printer                     6000 Mumbai

SQL> select * from supplier where sup_name like '_-a%';

no rows selected

SQL> select * from supplier where sup_name like '__a%';

no rows selected

SQL> select * from supplier where sup_name like '___a%';

SU SUP_NAME             ITEM_SUPPLIED        ITEAM_PRICE CITY
-- -------------------- -------------------- ----------- --------------------
S2 Kiran                Processor                   8000 Delhi
S3 Mohan                Mouse                        350 Delhi

SQL> select * from supplier;

SU SUP_NAME             ITEM_SUPPLIED        ITEAM_PRICE CITY
-- -------------------- -------------------- ----------- --------------------
S1 Suresh               Keyboard                     400 Hyderabad
S4 Ramesh               Processor                   9000 Bangalore
S2 Kiran                Processor                   8000 Delhi
S3 Mohan                Mouse                        350 Delhi
S5 Manish               Printer                     6000 Mumbai
S6 Srikanth             Processor                   8500 Chennai

6 rows selected.

SQL> select * from supplier where iteam_price between 5000 and 9000;

SU SUP_NAME             ITEM_SUPPLIED        ITEAM_PRICE CITY
-- -------------------- -------------------- ----------- --------------------
S4 Ramesh               Processor                   9000 Bangalore
S2 Kiran                Processor                   8000 Delhi
S5 Manish               Printer                     6000 Mumbai
S6 Srikanth             Processor                   8500 Chennai

SQL> select * from supplier where iteam_price in(5000,9000);

SU SUP_NAME             ITEM_SUPPLIED        ITEAM_PRICE CITY
-- -------------------- -------------------- ----------- --------------------
S4 Ramesh               Processor                   9000 Bangalore

SQL> select * from supplier where iteam_price in(5000,8000,9000);

SU SUP_NAME             ITEM_SUPPLIED        ITEAM_PRICE CITY
-- -------------------- -------------------- ----------- --------------------
S4 Ramesh               Processor                   9000 Bangalore
S2 Kiran                Processor                   8000 Delhi

SQL> SELECT sup_name FROM supplier WHERE EXISTS (SELECT sup_name FROM supplier WHERE iteam_price < 500);

SUP_NAME
--------------------
Suresh
Ramesh
Kiran
Mohan
Manish
Srikanth

6 rows selected.

SQL> SELECT sup_name FROM supplier WHERE iteam_price < 500;

SUP_NAME
--------------------
Suresh
Mohan

SQL> SELECT sup_name,iteam_price FROM supplier WHERE iteam_price < 500;

SUP_NAME             ITEAM_PRICE
-------------------- -----------
Suresh                       400
Mohan                        350

SQL> SELECT sup_name,iteam_price FROM supplier WHERE iteam_price < 100;

no rows selected

SQL> SELECT sup_name FROM supplier WHERE EXISTS (SELECT sup_name FROM supplier WHERE iteam_price < 100);

no rows selected

SQL> SELECT sup_name FROM supplier WHERE EXISTS (SELECT sup_name FROM supplier WHERE iteam_price < 50000);

SUP_NAME
--------------------
Suresh
Ramesh
Kiran
Mohan
Manish
Srikanth

6 rows selected.

SQL> SELECT sup_name,iteam_price FROM supplier WHERE iteam_price < 50000;

SUP_NAME             ITEAM_PRICE
-------------------- -----------
Suresh                       400
Ramesh                      9000
Kiran                       8000
Mohan                        350
Manish                      6000
Srikanth                    8500

6 rows selected.

SQL> SELECT sup_name FROM supplier WHERE iteam_price > all (SELECT sup_name FROM supplier WHERE iteam_price < 500)
  2  ;
SELECT sup_name FROM supplier WHERE iteam_price > all (SELECT sup_name FROM supplier WHERE iteam_price < 500)
                                                              *
ERROR at line 1:
ORA-01722: invalid number


 QL> SELECT sup_name FROM supplier WHERE iteam_price > all (SELECT iteam_price FROM supplier WHERE iteam_price < 500)
  2  ;

SUP_NAME
--------------------
Manish
Kiran
Srikanth
Ramesh

SQL> SELECT iteam_price FROM supplier WHERE iteam_price < 500;

ITEAM_PRICE
-----------
        400
        350

SQL> select * from supplier;

SU SUP_NAME             ITEM_SUPPLIED        ITEAM_PRICE CITY
-- -------------------- -------------------- ----------- --------------------
S1 Suresh               Keyboard                     400 Hyderabad
S4 Ramesh               Processor                   9000 Bangalore
S2 Kiran                Processor                   8000 Delhi
S3 Mohan                Mouse                        350 Delhi
S5 Manish               Printer                     6000 Mumbai
S6 Srikanth             Processor                   8500 Chennai

6 rows selected.

SQL> SELECT sup_name FROM supplier WHERE iteam_price > any (SELECT iteam_price FROM supplier WHERE iteam_price < 500);

SUP_NAME
--------------------
Suresh
Ramesh
Kiran
Manish
Srikanth
=====================
04-02-2026


SQL*Plus: Release 11.2.0.2.0 Production on Wed Feb 4 10:09:33 2026

Copyright (c) 1982, 2014, Oracle.  All rights reserved.

SQL> connect qtm230;
Enter password:
Connected.
SQL> select * from tab;

TNAME                          TABTYPE  CLUSTERID
------------------------------ ------- ----------
EMP1                           TABLE
EMP2                           TABLE
S1                             TABLE
STU1                           TABLE
SUPPLIER                       TABLE

SQL> select * from supplier;

SU SUP_NAME             ITEM_SUPPLIED        ITEAM_PRICE CITY
-- -------------------- -------------------- ----------- --------------------
S1 Suresh               Keyboard                     400 Hyderabad
S4 Ramesh               Processor                   9000 Bangalore
S2 Kiran                Processor                   8000 Delhi
S3 Mohan                Mouse                        350 Delhi
S5 Manish               Printer                     6000 Mumbai
S6 Srikanth             Processor                   8500 Chennai

6 rows selected.

SQL> commit;

Commit complete.

SQL> select * from supplier order by sup_name;

SU SUP_NAME             ITEM_SUPPLIED        ITEAM_PRICE CITY
-- -------------------- -------------------- ----------- --------------------
S2 Kiran                Processor                   8000 Delhi
S5 Manish               Printer                     6000 Mumbai
S3 Mohan                Mouse                        350 Delhi
S4 Ramesh               Processor                   9000 Bangalore
S6 Srikanth             Processor                   8500 Chennai
S1 Suresh               Keyboard                     400 Hyderabad

6 rows selected.

SQL> select * from supplier order by sup_name asc;

SU SUP_NAME             ITEM_SUPPLIED        ITEAM_PRICE CITY
-- -------------------- -------------------- ----------- --------------------
S2 Kiran                Processor                   8000 Delhi
S5 Manish               Printer                     6000 Mumbai
S3 Mohan                Mouse                        350 Delhi
S4 Ramesh               Processor                   9000 Bangalore
S6 Srikanth             Processor                   8500 Chennai
S1 Suresh               Keyboard                     400 Hyderabad

6 rows selected.

SQL> select * from supplier order by sup_name desc;

SU SUP_NAME             ITEM_SUPPLIED        ITEAM_PRICE CITY
-- -------------------- -------------------- ----------- --------------------
S1 Suresh               Keyboard                     400 Hyderabad
S6 Srikanth             Processor                   8500 Chennai
S4 Ramesh               Processor                   9000 Bangalore
S3 Mohan                Mouse                        350 Delhi
S5 Manish               Printer                     6000 Mumbai
S2 Kiran                Processor                   8000 Delhi

6 rows selected.

SQL> select * from supplier order by iteam_price asc;

SU SUP_NAME             ITEM_SUPPLIED        ITEAM_PRICE CITY
-- -------------------- -------------------- ----------- --------------------
S3 Mohan                Mouse                        350 Delhi
S1 Suresh               Keyboard                     400 Hyderabad
S5 Manish               Printer                     6000 Mumbai
S2 Kiran                Processor                   8000 Delhi
S6 Srikanth             Processor                   8500 Chennai
S4 Ramesh               Processor                   9000 Bangalore

6 rows selected.

SQL> select * from supplier order by iteam_price desc;

SU SUP_NAME             ITEM_SUPPLIED        ITEAM_PRICE CITY
-- -------------------- -------------------- ----------- --------------------
S4 Ramesh               Processor                   9000 Bangalore
S6 Srikanth             Processor                   8500 Chennai
S2 Kiran                Processor                   8000 Delhi
S5 Manish               Printer                     6000 Mumbai
S1 Suresh               Keyboard                     400 Hyderabad
S3 Mohan                Mouse                        350 Delhi

6 rows selected.

SQL> select * from supplier order by iteam_price,city desc;

SU SUP_NAME             ITEM_SUPPLIED        ITEAM_PRICE CITY
-- -------------------- -------------------- ----------- --------------------
S3 Mohan                Mouse                        350 Delhi
S1 Suresh               Keyboard                     400 Hyderabad
S5 Manish               Printer                     6000 Mumbai
S2 Kiran                Processor                   8000 Delhi
S6 Srikanth             Processor                   8500 Chennai
S4 Ramesh               Processor                   9000 Bangalore

6 rows selected.

SQL> select * from supplier order by city desc;

SU SUP_NAME             ITEM_SUPPLIED        ITEAM_PRICE CITY
-- -------------------- -------------------- ----------- --------------------
S5 Manish               Printer                     6000 Mumbai
S1 Suresh               Keyboard                     400 Hyderabad
S2 Kiran                Processor                   8000 Delhi
S3 Mohan                Mouse                        350 Delhi
S6 Srikanth             Processor                   8500 Chennai
S4 Ramesh               Processor                   9000 Bangalore

6 rows selected.

SQL> select * from supplier order by city asc;

SU SUP_NAME             ITEM_SUPPLIED        ITEAM_PRICE CITY
-- -------------------- -------------------- ----------- --------------------
S4 Ramesh               Processor                   9000 Bangalore
S6 Srikanth             Processor                   8500 Chennai
S2 Kiran                Processor                   8000 Delhi
S3 Mohan                Mouse                        350 Delhi
S1 Suresh               Keyboard                     400 Hyderabad
S5 Manish               Printer                     6000 Mumbai

6 rows selected.

SQL> select * from supplier where iteam_price >=6000 order by city asc;

SU SUP_NAME             ITEM_SUPPLIED        ITEAM_PRICE CITY
-- -------------------- -------------------- ----------- --------------------
S4 Ramesh               Processor                   9000 Bangalore
S6 Srikanth             Processor                   8500 Chennai
S2 Kiran                Processor                   8000 Delhi
S5 Manish               Printer                     6000 Mumbai

SQL> desc supplier;
 Name                                      Null?    Type
 ----------------------------------------- -------- ----------------------------
 SUP_NO                                    NOT NULL VARCHAR2(2)
 SUP_NAME                                  NOT NULL VARCHAR2(20)
 ITEM_SUPPLIED                             NOT NULL VARCHAR2(20)
 ITEAM_PRICE                                        NUMBER(5)
 CITY                                               VARCHAR2(20)

SQL>

SQL> select * from supplier;

SU SUP_NAME             ITEM_SUPPLIED        ITEAM_PRICE CITY
-- -------------------- -------------------- ----------- --------------------
S1 Suresh               Keyboard                     400 Hyderabad
S4 Ramesh               Processor                   9000 Bangalore
S2 Kiran                Processor                   8000 Delhi
S3 Mohan                Mouse                        350 Delhi
S5 Manish               Printer                     6000 Mumbai
S6 Srikanth             Processor                   8500 Chennai

6 rows selected.

SQL> select * from dual;

D
-
X

SQL> select sysdate from dual;

SYSDATE
---------
04-FEB-26

SQL> select sysdate from supplier;

SYSDATE
---------
04-FEB-26
04-FEB-26
04-FEB-26
04-FEB-26
04-FEB-26
04-FEB-26

6 rows selected.

SQL> select sysdate from dual;

SYSDATE
---------
04-FEB-26

SQL> select systimestamp from dual;

SYSTIMESTAMP
---------------------------------------------------------------------------
04-FEB-26 10.26.32.440000 AM +05:30

SQL> select current_timestamp from dual;

CURRENT_TIMESTAMP
---------------------------------------------------------------------------
04-FEB-26 10.27.43.174000 AM +05:30

SQL> select avg(30+20+10)/3 from dual;

AVG(30+20+10)/3
---------------
             20

SQL> select avg(iteam_price) from supplier;

AVG(ITEAM_PRICE)
----------------
            5375

SQL> select sum(iteam_price) from supplier;

SUM(ITEAM_PRICE)
----------------
           32250

SQL> select max(iteam_price) from supplier;

MAX(ITEAM_PRICE)
----------------
            9000

SQL> select min(iteam_price) from supplier;

MIN(ITEAM_PRICE)
----------------
             350

SQL> select count(*) from supplier;

  COUNT(*)
----------
         6

SQL> select * from tab;

TNAME                          TABTYPE  CLUSTERID
------------------------------ ------- ----------
EMP1                           TABLE
EMP2                           TABLE
S1                             TABLE
STU1                           TABLE
SUPPLIER                       TABLE

SQL> select * from stu1
  2  ;

     STUID SNAME                     MARKS
---------- -------------------- ----------
      1001 Krishna                     999
      1002 Ramesh                      899
      1003 Suresh                      799
      1004 Mahesh                      699
      1005 Ganesh                      599
      1006 Rajesh                      499

6 rows selected.

SQL> select * from s1;

        ID        SAL EMPSTATU         DA   TOTALSAL
---------- ---------- -------- ---------- ----------
         1        501 active          200        701
         2        601 active          200        801
         3        701 active          200        901
         4            active          200

SQL> select count(*) from stu1
  2  ;

  COUNT(*)
----------
         6

SQL> select count(*) from s1;

  COUNT(*)
----------
         4

SQL> select count(sal) from s1;

COUNT(SAL)
----------
         3

SQL> select count(da) from s1;

 COUNT(DA)
----------
         4

SQL> select count(distinct da) from s1;

COUNT(DISTINCTDA)
-----------------
                1

SQL> select count(distinct iteam_supplied) from s1;
select count(distinct iteam_supplied) from s1
                      *
ERROR at line 1:
ORA-00904: "ITEAM_SUPPLIED": invalid identifier


SQL> select count(distinct iteam_supplied) from supplier;
select count(distinct iteam_supplied) from supplier
                      *
ERROR at line 1:
ORA-00904: "ITEAM_SUPPLIED": invalid identifier


SQL> select count(distinct item_supplied) from supplier;

COUNT(DISTINCTITEM_SUPPLIED)
----------------------------
                           4

SQL> select count(item_supplied) from supplier;

COUNT(ITEM_SUPPLIED)
--------------------
                   6

SQL>

SQL> select * from supplier;

SU SUP_NAME             ITEM_SUPPLIED        ITEAM_PRICE CITY
-- -------------------- -------------------- ----------- --------------------
S1 Suresh               Keyboard                     400 Hyderabad
S4 Ramesh               Processor                   9000 Bangalore
S2 Kiran                Processor                   8000 Delhi
S3 Mohan                Mouse                        350 Delhi
S5 Manish               Printer                     6000 Mumbai
S6 Srikanth             Processor                   8500 Chennai

6 rows selected.

SQL> select upper(sup_name) from supplier;

UPPER(SUP_NAME)
--------------------
SURESH
RAMESH
KIRAN
MOHAN
MANISH
SRIKANTH

6 rows selected.

SQL> select lower(sup_name) from supplier;

LOWER(SUP_NAME)
--------------------
suresh
ramesh
kiran
mohan
manish
srikanth

6 rows selected.

SQL> select lower(sup_name,item_supplied) from supplier;
select lower(sup_name,item_supplied) from supplier
       *
ERROR at line 1:
ORA-00909: invalid number of arguments


SQL> select lower(item_supplied) from supplier;

LOWER(ITEM_SUPPLIED)
--------------------
keyboard
processor
processor
mouse
printer
processor

6 rows selected.

SQL> select initcap(item_supplied) from supplier;

INITCAP(ITEM_SUPPLIE
--------------------
Keyboard
Processor
Processor
Mouse
Printer
Processor

6 rows selected.

SQL> select length(item_supplied) from supplier;

LENGTH(ITEM_SUPPLIED)
---------------------
                    8
                    9
                    9
                    5
                    7
                    9

6 rows selected.

SQL> select length('Krishna') from dual;

LENGTH('KRISHNA')
-----------------
                7

SQL> select length('abcd') from dual;

LENGTH('ABCD')
--------------
             4

SQL> select length('12345') from dual;

LENGTH('12345')
---------------
              5

SQL> SELECT REPLACE('Hello World', 'Hello', 'Hi') AS Result FROM dual;

RESULT
--------
Hi World

SQL> select * from supplier;

SU SUP_NAME             ITEM_SUPPLIED        ITEAM_PRICE CITY
-- -------------------- -------------------- ----------- --------------------
S1 Suresh               Keyboard                     400 Hyderabad
S4 Ramesh               Processor                   9000 Bangalore
S2 Kiran                Processor                   8000 Delhi
S3 Mohan                Mouse                        350 Delhi
S5 Manish               Printer                     6000 Mumbai
S6 Srikanth             Processor                   8500 Chennai

6 rows selected.

SQL> SELECT REPLACE('Suresh', 'Su', 'Ka') from supplier;

REPLAC
------
Karesh
Karesh
Karesh
Karesh
Karesh
Karesh

6 rows selected.

SQL> SELECT REPLACE('Suresh', 'Su', 'Ka') from dual;

REPLAC
------
Karesh

SQL> select LPAD('oracle',10,'z') from dual;

LPAD('ORAC
----------
zzzzoracle

SQL> select RPAD('oracle',10,'z') from dual;

RPAD('ORAC
----------
oraclezzzz

SQL> select RPAD('oracle',6,'z') from dual;

RPAD('
------
oracle

SQL> select RPAD('oracle',20,'z') from dual;

RPAD('ORACLE',20,'Z'
--------------------
oraclezzzzzzzzzzzzzz

SQL> select LPAD('Krishna',9,'MR.') from dual;

LPAD('KRI
---------
MRKrishna

SQL> select LPAD('Krishna',10,'MR.') from dual;

LPAD('KRIS
----------
MR.Krishna

SQL> SELECT LTRIM(' Hello World') AS trimmed_string FROM dual;

TRIMMED_STR
-----------
Hello World

SQL> SELECT LTRIM(' Hello World  ') AS trimmed_string FROM dual;

TRIMMED_STRIN
-------------
Hello World

SQL> SELECT LTRIM(' Hello   World  ') AS trimmed_string FROM dual;

TRIMMED_STRING
---------------
Hello   World

SQL> SELECT RTRIM(' Hello   World  ') AS trimmed_string FROM dual;

TRIMMED_STRING
--------------
 Hello   World

SQL> SELECT TRIM(' Hello World  ') AS trimmed_string FROM dual;

TRIMMED_STR
-----------
Hello World

SQL> SELECT INSTR('Hello World', 'Wo') AS position FROM dual;

  POSITION
----------
         7

SQL> SELECT INSTR('Hello World', 'e') AS position FROM dual;

  POSITION
----------
         2

SQL> Select SUBSTR(‘ORACLE’,2,3) from dual;
ERROR:
ORA-01756: quoted string not properly terminated


SQL> Select SUBSTR('ORACLE',2,3) from dual;

SUB
---
RAC

SQL> Select SUBSTR('ORACLE',5,3) from dual;

SU
--
LE

SQL> SELECT CONCAT('Hello', 'World') AS concatenated_string FROM dual;

CONCATENAT
----------
HelloWorld

SQL> SELECT CONCAT('Hello', 'World') FROM dual;

CONCAT('HE
----------
HelloWorld

SQL> select 55+25 from dual;

     55+25
----------
        80

SQL> select 55+25 as sum from dual;

       SUM
----------
        80

SQL> SELECT TRANSLATE(sup_name, 'ae', '12') FROM s1;
SELECT TRANSLATE(sup_name, 'ae', '12') FROM s1
                 *
ERROR at line 1:
ORA-00904: "SUP_NAME": invalid identifier


SQL> SELECT TRANSLATE(supname, 'ae', '12') FROM s1;
SELECT TRANSLATE(supname, 'ae', '12') FROM s1
                 *
ERROR at line 1:
ORA-00904: "SUPNAME": invalid identifier


SQL> SELECT TRANSLATE(sup_name, 'ae', '12') FROM supplier;

TRANSLATE(SUP_NAME,'AE','12')
--------------------------------------------------------------------------------
Sur2sh
R1m2sh
Kir1n
Moh1n
M1nish
Srik1nth

6 rows selected.

SQL> SELECT TRANSLATE('abcde', 'ace', '952') FROM supplier;

TRANS
-----
9b5d2
9b5d2
9b5d2
9b5d2
9b5d2
9b5d2

6 rows selected.

SQL> SELECT TRANSLATE('abcde', 'ace', '952') FROM dual;;
SELECT TRANSLATE('abcde', 'ace', '952') FROM dual;
                                                 *
ERROR at line 1:
ORA-00911: invalid character


SQL> SELECT TRANSLATE('abcde', 'ace', '952') FROM dual;

TRANS
-----
9b5d2

SQL> SELECT TRANSLATE('abcde', 'ace', '95#') FROM dual;

TRANS
-----
9b5d#

SQL> SELECT TRANSLATE('abcde', 'ace', '9B#') FROM dual;

TRANS
-----
9bBd#

SQL> SELECT ASCII(A) FROM dual;
SELECT ASCII(A) FROM dual
             *
ERROR at line 1:
ORA-00904: "A": invalid identifier


SQL> SELECT ASCII('A') FROM dual;

ASCII('A')
----------
        65

SQL> SELECT ASCII('ABCD') FROM dual;

ASCII('ABCD')
-------------
           65

SQL> SELECT sup_name, ascii(sup_name) FROM supplier;

SUP_NAME             ASCII(SUP_NAME)
-------------------- ---------------
Suresh                            83
Ramesh                            82
Kiran                             75
Mohan                             77
Manish                            77
Srikanth                          83

6 rows selected.

SQL> SELECT ASCII('a') FROM dual;

ASCII('A')
----------
        97

SQL> SELECT ASCII('#') FROM dual;

ASCII('#')
----------
        35

SQL>